{
  "$schema": "http://json-schema.org/draft-07/schema#",
  "title": "Atlas dungeon complex",
  "description": "A dungeon is a FILE FAMILY, never a spine tier: making it a node would drag its area into the composition rollup and into the per-parent quadratic overlap check for no gate coverage the fabric gates cannot provide. It joins the world by bind.handle exactly as content/towns/town-millcross.json joins by spineId. spineId is required and must be null — an explicit null is a refusal, an absent key is an oversight.",
  "type": "object",
  "required": ["id", "title", "family", "bind", "entranceType", "floors", "levelBand", "spineId"],
  "additionalProperties": false,
  "properties": {
    "id": { "type": "string", "pattern": "^dungeon-[a-z0-9]+(-[a-z0-9]+)*$" },
    "title": { "type": "string", "minLength": 1 },
    "family": { "type": ["string", "null"], "pattern": "^family-[a-z0-9-]+$" },
    "familyIndex": { "type": "integer", "minimum": 0, "maximum": 7 },
    "bind": {
      "type": "object", "required": ["handle"], "additionalProperties": false,
      "properties": { "handle": { "type": "string", "pattern": "^c[0-9]{2}/[a-z-]+/h-[0-9a-f]{4,6}$" } }
    },
    "entranceType": { "type": "string", "minLength": 1 },
    "floors": { "type": "integer", "minimum": 1, "maximum": 12 },
    "levelBand": { "type": "array", "minItems": 2, "maxItems": 2, "items": { "type": "integer", "minimum": 1, "maximum": 80 } },
    "hazards": { "type": "array", "items": { "type": "string", "minLength": 1 } },
    "roomCountCurve": { "type": "array", "minItems": 1, "items": { "type": "integer", "minimum": 1 } },
    "note": { "type": "string" },
    "prose": { "type": "string", "enum": ["authored", "frontier"] },
    "lore": {
      "type": "object",
      "additionalProperties": false,
      "properties": {
        "note": { "type": "string", "minLength": 1 },
        "source": { "type": "string", "minLength": 1 }
      }
    },
    "provenance": {
      "type": "object",
      "required": ["authored", "generator"],
      "additionalProperties": false,
      "properties": {
        "authored": { "type": "string", "enum": ["hand", "generated"] },
        "generator": { "type": ["object", "null"] }
      }
    },
    "spineId": { "type": "null" }
  },
  "allOf": [
    {
      "if": { "properties": { "family": { "type": "null" } }, "required": ["family"] },
      "then": {
        "not": { "required": ["familyIndex"] },
        "required": ["roomCountCurve", "lore", "prose", "provenance"]
      }
    },
    {
      "if": { "properties": { "family": { "type": "string" } }, "required": ["family"] },
      "then": { "required": ["familyIndex"] }
    }
  ]
}
